{
  "schema_version": "foodstateedit.run.v1",
  "run_id": "ramen_chopsticks_001__geoedit_unified_action_mask__seed_1",
  "case_id": "ramen_chopsticks_001",
  "method": "geoedit_unified_action_mask",
  "seed": 1,
  "model": {
    "name": "Wan2.2-VACE-Fun-A14B",
    "root": "/host/space0/guo-z/models/PAI/Wan2.2-VACE-Fun-A14B",
    "files": [
      {
        "path": "/host/space0/guo-z/models/PAI/Wan2.2-VACE-Fun-A14B/high_noise_model/diffusion_pytorch_model.safetensors",
        "size_bytes": 34675325000,
        "sha256": "66c61b736c5674deeeef17861e494d3652cc9b1463a9656bf18c2c72d2c5f007"
      },
      {
        "path": "/host/space0/guo-z/models/PAI/Wan2.2-VACE-Fun-A14B/low_noise_model/diffusion_pytorch_model.safetensors",
        "size_bytes": 34675325000,
        "sha256": "0bf791adfb8330d451d2f5c03577b2a8fb780453f8ef05e23a8fa91f27a2134d"
      },
      {
        "path": "/host/space0/guo-z/models/PAI/Wan2.2-VACE-Fun-A14B/models_t5_umt5-xxl-enc-bf16.pth",
        "size_bytes": 11361920418,
        "sha256": "7cace0da2b446bbbbc57d031ab6cf163a3d59b366da94e5afe36745b746fd81d"
      },
      {
        "path": "/host/space0/guo-z/models/PAI/Wan2.2-VACE-Fun-A14B/Wan2.1_VAE.pth",
        "size_bytes": 507609880,
        "sha256": "38071ab59bd94681c686fa51d75a1968f64e470262043be31f7a094e442fd981"
      }
    ],
    "verified_before_run": true,
    "full_file_hash_audit": "/host/space0/guo-z/tf-ufi/outputs/paper_sprint_day3_20260827_model_hash_v1/wan_model_sha256.txt",
    "full_file_hash_audit_sha256": "4c255c04811a2bc1484db5dae01bdc7352ebd4ad0bd7802b13cebe0bc669d34b"
  },
  "inference": {
    "width": 736,
    "height": 592,
    "frames": 21,
    "steps": 20,
    "warm_start": false,
    "schedule": {
      "rigid": 15,
      "contact": 15,
      "material": 15,
      "hole": 15
    },
    "tweak_index": 3,
    "tstrong_index": 15,
    "replace_mode": "mask_new",
    "motion_signal_mask": "edit_alpha.png",
    "common_proxy_manifest_sha256": "a65441d868f8f6ee7d416c255eb9ee7b75cab02765f043fc6a5023d218325862",
    "exact_protection_projection": true,
    "decoded_frames": 21,
    "outside_edit_alpha_max_pixel_difference": 0
  },
  "environment": {
    "host": "gp40.cs.uec.ac.jp",
    "gpu": "NVIDIA RTX A6000; CUDA_VISIBLE_DEVICES=0",
    "python": "/host/home/yanai-lab/Sotsuken24/guo-z/.conda/envs/sam3_env/bin/python3.12",
    "code_commit": "fa7583c60913d05754b6aa430b579d09dbc11ac8+foodstateedit_overrides_f7848821",
    "created_at": "2026-08-27T10:56:03+09:00",
    "launcher_file": {
      "path": "/host/space0/guo-z/tf-ufi/outputs/paper_sprint_day3_20260827_launchers_v2/run_geoedit_anchor.py",
      "size_bytes": 13848,
      "sha256": "e839949a8bb2d1d6df30d352f210ed03c2192c27274a837a7ed5d0e8596b623c"
    },
    "geoedit_files": [
      {
        "path": "/host/space0/guo-z/GeoEdit/geoedit/inference.py",
        "size_bytes": 15432,
        "sha256": "f78488216536e70744e839c0294319f334d541adc36f9e76136c14e7ffd328fa"
      },
      {
        "path": "/host/space0/guo-z/GeoEdit/diffsynth/pipelines/wan_video.py",
        "size_bytes": 98411,
        "sha256": "28a1b5e3939983139e2dcd4a7f19d085fcec0017434793bac163767b7ae29c00"
      },
      {
        "path": "/host/space0/guo-z/GeoEdit/diffsynth/utils/data/__init__.py",
        "size_bytes": 8873,
        "sha256": "fe056b4a675a345cf02d6c76d327e8434103ccf2a4066ff208ce41368771e360"
      },
      {
        "path": "/host/space0/guo-z/GeoEdit/tests/test_masks.py",
        "size_bytes": 2698,
        "sha256": "57176ea2595f236846e1d38a79f58e3d586a99e67ce7ef0df4747af768a982da"
      }
    ]
  },
  "status": "complete",
  "outputs": [
    {
      "path": "/host/space0/guo-z/tf-ufi/outputs/paper_sprint_day3_20260827_unified_geoedit_smoke_v1/ramen_chopsticks_001/seed_1/result.mp4",
      "sha256": "f48ae656199391eff47d1b93f9ea41a2d42b0986ef127f0eb5f2cf7bb01bf6b4"
    },
    {
      "path": "/host/space0/guo-z/tf-ufi/outputs/paper_sprint_day3_20260827_unified_geoedit_smoke_v1/ramen_chopsticks_001/seed_1/raw_last_frame.png",
      "sha256": "a7244fb691da7b67d6cb11c2e1222c7f18e3472d96c2dcc5538e6e932e116d22"
    },
    {
      "path": "/host/space0/guo-z/tf-ufi/outputs/paper_sprint_day3_20260827_unified_geoedit_smoke_v1/ramen_chopsticks_001/seed_1/edited_2d.png",
      "sha256": "c5433e407780ba1f75663f877effc217543a5ea89cf5425479270863119c6ca6"
    }
  ]
}
